{
  "contractVersion": "1.0.0",
  "eventId": "evt_01K2D",
  "eventType": "invocation.started",
  "schemaVersion": "1.0.0",
  "occurredAt": "2026-07-12T08:04:12.100Z",
  "recordedAt": "2026-07-12T08:04:12.108Z",
  "tenantId": "tenant_acme_eu",
  "workspaceId": "workspace_procurement",
  "region": "eu-west",
  "aggregateType": "run",
  "aggregateId": "run_01K2A",
  "aggregateVersion": 27,
  "rootRunId": "run_01K2A",
  "runId": "run_01K2A",
  "runSequence": 141,
  "activityId": "create-order",
  "activityRunId": "activity_run_create_order_01",
  "activityAttemptId": "activity_attempt_create_order_02",
  "effectId": "effect_01K2B",
  "invocationId": "invocation_01K2I2",
  "workerLeaseId": "worker_lease_01K2L",
  "actor": {
    "type": "service",
    "id": "runtime-worker",
    "onBehalfOf": "user_887",
    "authnMethod": "workload_identity"
  },
  "correlationId": "corr_5501",
  "causationId": "evt_01K2C",
  "traceId": "4bf92f3577b34da6a3ce929d0e0e4736",
  "dataClassification": "confidential",
  "payloadDigest": "sha256:65fe...",
  "payloadRef": "payload://encrypted/sha256/65fe...",
  "retentionPolicyRef": "regulated-execution@7.0.0"
}